{
  "meta": {
    "title": "The Entropy System Guide",
    "subtitle": "A Self-Documenting Interactive Textbook",
    "author": "Scott Duhadway",
    "version": "1.0.0",
    "created": "2026-04-20T00:00:00Z",
    "modified": "2026-04-20T00:00:00Z",
    "description": "Learn how to use EntropyExplainer and EntropyEditor by reading this textbook inside EntropyExplainer. Every feature of the system is demonstrated by the content itself.",
    "license": "MIT",
    "tags": ["entropy", "guide", "meta", "self-referential"]
  },
  "root": "welcome",
  "nodes": {
    "welcome": {
      "id": "welcome",
      "title": "Welcome to Entropy",
      "summary": "You are reading this inside the tool it describes. Everything you see here is a feature demonstration.",
      "content": "Entropy is two tools that share one content format:\n\n- **EntropyExplainer** is the reader you are using right now. It turns structured content into a choose-your-own-adventure textbook.\n- **EntropyEditor** is the authoring tool. It produces the `.entropy.json` files that this reader consumes.\n\nThis guide teaches you both tools by example. The sidebar on your left shows the full table of contents. The cards below let you choose what to explore first.\n\n## How to Navigate\n\nYou have several ways to move through this book:\n\n- **Child cards** below each section lead deeper into a topic\n- **Connection pills** at the bottom link to related topics sideways\n- **Back** and **Home** buttons retrace your steps\n- **Prev / Next** buttons follow the linear chapter order\n- **Sidebar** lets you jump anywhere\n- **Keyboard**: Alt+Left goes back, / focuses search, Ctrl+/ toggles the sidebar\n\nPick a path and start exploring. The blue dots in the sidebar will track where you have been.",
      "children": ["content-format", "the-reader", "the-editor"],
      "connections": [
        { "to": "quick-start", "label": "Skip ahead to the quick-start", "type": "tangent" },
        { "to": "architecture", "label": "Technical architecture overview", "type": "deeper" }
      ],
      "media": [],
      "tags": ["overview", "start-here"],
      "difficulty": "intro",
      "estimatedTime": "3 min",
      "order": 1
    },
    "content-format": {
      "id": "content-format",
      "title": "The .entropy.json Format",
      "summary": "A single JSON file defines an entire textbook. Here is what goes inside it.",
      "content": "Every Entropy textbook is one `.entropy.json` file. The format has four top-level keys:\n\n1. **meta** — book-level metadata (title, author, version, timestamps, description, tags)\n2. **root** — the ID of the entry node (where readers start)\n3. **nodes** — an object of all content nodes, keyed by their ID\n4. **themes** — optional theme configuration for the reader\n\n## What Is a Node?\n\nA node is one section of content. Think of it as a page, a chapter, or a concept — whatever granularity fits your material. Each node has:\n\n- **id** — a URL-safe slug like `supply-chain-basics`\n- **title** — what appears in the sidebar and at the top of the page\n- **summary** — a brief description shown on parent cards (like the italicized text you see below this title)\n- **content** — the body text, written in Markdown\n- **children** — an ordered list of child node IDs (the cards below this section)\n- **connections** — cross-links to other nodes with a type and optional label\n- **media** — images, video, audio, embeds, or diagrams\n- **tags** — free-form labels for categorization\n- **difficulty** — one of: intro, intermediate, advanced, expert\n- **estimatedTime** — a human-readable time estimate like \"5 min\"\n- **order** — numeric sort order among siblings\n\nThe schema is formally defined in `shared/schema.json` and is validated by both tools.",
      "children": ["node-children", "node-connections", "node-content-markdown"],
      "connections": [
        { "to": "the-editor", "label": "How to create this format", "type": "related" },
        { "to": "architecture", "label": "Technical deep-dive", "type": "deeper" }
      ],
      "media": [],
      "tags": ["format", "json", "schema"],
      "difficulty": "intro",
      "estimatedTime": "5 min",
      "order": 2
    },
    "node-children": {
      "id": "node-children",
      "title": "Children: Building Hierarchy",
      "summary": "Children define the tree structure. They are ordered, and they render as the clickable cards you see below each section.",
      "content": "The `children` array on each node is an ordered list of node IDs. This creates the tree structure that powers:\n\n- The **sidebar navigation** (the indented list on the left)\n- The **child cards** (the clickable boxes below this text)\n- The **Prev/Next** linear order (depth-first walk of the tree)\n- The **breadcrumb trail** (the path shown above the title)\n\n## Ordering Matters\n\nChildren appear in the order listed. The first child is the first card, the first sidebar entry, and the first stop on the linear path.\n\n## Orphan Nodes\n\nA node that is not any other node's child is an \"orphan.\" Orphans still appear in the sidebar (at the bottom), but they are not part of the linear navigation flow. They are reachable via connections or direct search.\n\n## Circular References\n\nThe system handles cycles gracefully. If Node A lists Node B as a child, and Node B lists Node A, the tree renderer uses a visited-set to avoid infinite loops. The first encounter wins.",
      "children": [],
      "connections": [
        { "to": "node-connections", "label": "Connections vs. children", "type": "related" },
        { "to": "editor-children", "label": "Managing children in the editor", "type": "related" }
      ],
      "media": [],
      "tags": ["hierarchy", "tree", "navigation"],
      "difficulty": "intro",
      "estimatedTime": "4 min",
      "order": 1
    },
    "node-connections": {
      "id": "node-connections",
      "title": "Connections: Cross-Linking",
      "summary": "Connections are non-hierarchical links between nodes. They have types that indicate the nature of the relationship.",
      "content": "While children define the tree, connections define the web. They are the \"choose your own adventure\" links that let readers explore laterally.\n\nEach connection has:\n\n- **to** — the target node ID\n- **type** — one of five relationship types\n- **label** — optional display text (defaults to the target's title)\n\n## Connection Types\n\nThe five types each render with a distinct color:\n\n- **related** (blue) — general association between topics\n- **prerequisite** (amber) — \"you should read this first\"\n- **deeper** (purple) — a more advanced take on the same topic\n- **example** (green) — a concrete illustration or case study\n- **tangent** (pink) — interesting but not essential; a rabbit hole\n\nLook at the connection pills below this section. Each one demonstrates a different type. Click any to follow the link.\n\n## One-Way Links\n\nConnections are directional. If Node A connects to Node B, that does not mean Node B connects back to A. You can create reciprocal links in the editor if you want bidirectional navigation.",
      "children": [],
      "connections": [
        { "to": "node-children", "label": "Children vs. connections", "type": "related" },
        { "to": "content-format", "label": "Review the full node schema", "type": "prerequisite" },
        { "to": "architecture", "label": "How connections render in the graph", "type": "deeper" },
        { "to": "quick-start", "label": "Practical walkthrough", "type": "example" },
        { "to": "extending", "label": "Adding new connection types", "type": "tangent" }
      ],
      "media": [],
      "tags": ["connections", "cross-links", "navigation"],
      "difficulty": "intermediate",
      "estimatedTime": "5 min",
      "order": 2
    },
    "node-content-markdown": {
      "id": "node-content-markdown",
      "title": "Writing Content in Markdown",
      "summary": "Node content is written in Markdown. Both tools parse it — the editor gives you a rich text toolbar, the reader renders it to HTML.",
      "content": "The `content` field of each node is a Markdown string. Both tools parse it independently:\n\n- **EntropyExplainer** uses a custom parser (`js/markdown.js`) that handles headings, bold, italic, code, links, lists, blockquotes, code blocks, horizontal rules, and strikethrough.\n- **EntropyEditor** converts Markdown to HTML for its contenteditable WYSIWYG editor, and converts it back on save.\n\n## Supported Syntax\n\nHere is every formatting option, demonstrated live:\n\n### Headings\n\nThis is an H3 heading (above). H1 and H2 also work.\n\n### Inline Formatting\n\n**Bold text** is wrapped in double asterisks. *Italic text* uses single asterisks. `Inline code` uses backticks. [Links](https://example.com) use bracket-paren syntax. ~~Strikethrough~~ uses tildes.\n\n### Lists\n\nUnordered:\n\n- First item\n- Second item\n- Third item\n\nOrdered:\n\n1. Step one\n2. Step two\n3. Step three\n\n### Blockquotes\n\n> This is a blockquote. Use it for callouts, quotations, or emphasis.\n\n### Code Blocks\n\n```\n{\n  \"id\": \"example-node\",\n  \"title\": \"A Minimal Node\",\n  \"content\": \"Hello, world.\",\n  \"children\": [],\n  \"connections\": []\n}\n```\n\n### Horizontal Rules\n\nA line of three dashes creates a separator:\n\n---\n\nAll of these round-trip cleanly through the editor. What you write in Markdown is what you see in the reader.",
      "children": [],
      "connections": [
        { "to": "editor-toolbar", "label": "The toolbar that generates this Markdown", "type": "related" },
        { "to": "content-format", "label": "Back to the format overview", "type": "prerequisite" }
      ],
      "media": [],
      "tags": ["markdown", "formatting", "syntax"],
      "difficulty": "intro",
      "estimatedTime": "6 min",
      "order": 3
    },
    "the-reader": {
      "id": "the-reader",